{
  "run_id": "20260112_213244",
  "created_at": "2026-01-12T21:36:06.075908",
  "topic": "discrete audio tokens more than a survey",
  "input_pdf_dir": "/Users/xjp/Desktop/Survey-with-LLMs/Survey-for-survey-review-with-LLMs/AUTOSR-SDSE/workspaces/discrete_audio_tokens_more_than_a_survey/seed/downloads/arxiv",
  "input_pdfs": [
    "/Users/xjp/Desktop/Survey-with-LLMs/Survey-for-survey-review-with-LLMs/AUTOSR-SDSE/workspaces/discrete_audio_tokens_more_than_a_survey/seed/downloads/arxiv/2502.06490.pdf"
  ],
  "prompt_path": "/Users/xjp/Desktop/Survey-with-LLMs/Survey-for-survey-review-with-LLMs/AUTOSR-SDSE/resources/LLM/prompts/keyword_extractor/generate_search_terms.md",
  "outputs": [
    {
      "name": "codex_keywords",
      "path": "/Users/xjp/Desktop/Survey-with-LLMs/Survey-for-survey-review-with-LLMs/AUTOSR-SDSE/docs/codex/test-keywords/outputs/20260112_213244/codex_keywords.json",
      "mode": "single",
      "provider": "codex",
      "reviewer": "Keywords",
      "model": "gpt-5.1-codex-mini"
    }
  ],
  "commands": [
    {
      "provider": "codex",
      "command": "/opt/homebrew/bin/codex exec --disable web_search_request - --model gpt-5.1-codex-mini --output-schema /Users/xjp/Desktop/Survey-with-LLMs/Survey-for-survey-review-with-LLMs/AUTOSR-SDSE/docs/codex/test-keywords/keywords_response_codex.schema.json",
      "model": "gpt-5.1-codex-mini"
    }
  ]
}